{
  "schemaVersion": 1,
  "receiptId": "rc2-20260821-001",
  "harnessVersion": "0.1.1-rc.2",
  "harnessCommit": "b150a551b8d465e31e418e1b2eaf5e79bbb7d28e",
  "parentCommit": "141eb6fef83422698aef7a981029e843e8161534",
  "diffSha256": "bbbbbbbbbbbbbbbbbbbbbbbbbbbbbbbbbbbbbbbbbbbbbbbbbbbbbbbbbbbbbbbb",
  "impactMapVersion": "1.0.0",
  "gateRuleVersion": "1.0.0",
  "changedSurfaces": [
    "packages/client/src/runtime.ts",
    "packages/host/src/profile.ts"
  ],
  "gateLevel": "G2",
  "personalVersion": "0.4.2",
  "personalArtifactSha256": "cccccccccccccccccccccccccccccccccccccccccccccccccccccccccccccccc",
  "pluginGenerationHash": "dddddddddddddddddddddddddddddddddddddddddddddddddddddddddddddddd",
  "dependencyToolchainHash": "eeeeeeeeeeeeeeeeeeeeeeeeeeeeeeeeeeeeeeeeeeeeeeeeeeeeeeeeeeeeeeee",
  "evidence": [
    {
      "check": "candidate-build",
      "status": "executed"
    },
    {
      "check": "plugin-closure-typecheck",
      "status": "reused:rc2-20260820-004"
    }
  ],
  "conclusion": "compatible",
  "generatedAt": "2026-08-21T12:00:00.000Z",
  "validUntil": "2026-08-28T12:00:00.000Z",
  "revoked": false,
  "g3Anchor": {
    "lastG3At": "2026-08-21T06:00:00.000Z",
    "lastG3ReceiptId": "rc2-g3-20260821-000"
  }
}
